Анна Каренина	Ana Karenina	Anna Karenina	Anna Karenina	Anna Karenina
"Татарин, вспомнив манеру Степана Аркадьича не называть кушанья по французской карте, не повторял за ним, но доставил себе удовольствие повторить весь заказ по карте: ""Суп прентаньер, тюрбо сос Бомарше, пулард а лестрагон, маседуан де фрюи..."" -- и тотчас, как на пружинах, положив одну переплетенную карту и подхватив другую, карту вин, поднес ее Степану Аркадьичу."	Yo había despedido el mío...	'Well, sometimes it seems so to me.	Sull’ultimo scalino inciampò, ma, sfiorato appena il ghiaccio con la mano, fece un movimento brusco, si raddrizzò e, ridendo e pattinando, volò via.	Aber es schien ihm, als liege in ihrer Freundlichkeit ein besonderer, geflissentlich ruhiger Ton.
-- Что же пить будем?	Hicieron el camino en silencio.	You know, that would be terrible both for her and for me.'	“Bravo, simpatico — pensò Kitty, uscendo in quel momento dal casotto con m.lle Linon e guardandolo con un sereno sorriso carezzevole, come un fratello al quale si vuol bene.	Und es wurde ihm schwer ums Herz.
--	Levin pensaba en lo que podía significar aquel cambio de expresión en el rostro de Kitty, y ya se sentía animado en sus esperanzas, ya se sentía hundido en la desesperación, y considerando que sus ilusiones eran insensatas.	'Oh no!	— Possibile che io sia colpevole,	Nachdem sie ein Weilchen über ihre alte Erzieherin und deren Absonderlichkeiten gesprochen hatte, fragte sie ihn nach seiner Lebensweise.
Я что хочешь, только немного, шампанское, -- сказал Левин.	No obstante, tenía la sensación de ser otro hombre, de no parecerse en nada a aquel a quien ella había sonreído y a quien había dicho: «Hasta luego».	In any case there's nothing in it terrible for the girl.	possibile che abbia fatto qualcosa di male?	»Langweilen Sie sich denn im Winter auf dem Lande gar nicht?« fragte sie.
-- Как?	Esteban Arkadievich, entre tanto, iba componiendo el menú por el camino.	Every girl is proud of an offer.'	Dicono:	»Nein, ich langweile mich nicht, ich habe viel zu tun«, erwiderte er und fühlte dabei, daß sie ihn durch ihren ruhigen Ton in Schranken hielt und daß er jetzt ebensowenig imstande sein werde, diese Schranken zu durchbrechen, wie er es zu Anfang des Winters gekonnt hatte.
сначала?	–¿Te gusta el rodaballo? –preguntó a Levin, cuando llegaban.	'Yes, every girl, but not she.'	civetteria.	»Sind Sie zu längerem Aufenthalte nach Moskau gekommen?« fragte ihn Kitty.
А впрочем, правда, пожалуй.	–¿Qué? –El rodaballo.	Oblonsky smiled.	Lo so che non amo lui, ma intanto con lui ci sto volentieri e lui è così bravo.	»Ich weiß es nicht«, antwortete er, ohne zu überlegen, was er sagte.
Ты любишь с белою печатью?	–¡Oh! Sí, sí, me gusta con locura.	He understood that feeling of Levin's so well, knew that for Levin all the girls in the world were divided into two classes: one class included all the girls in the world except her, and they had all the usual human failings and were very ordinary girls; while the other class – herself alone – had no weaknesses and was superior to all humanity.	Ma perché ha detto quella cosa?	Es kam ihm der Gedanke, wenn er sich wieder diesem ruhig-freundschaftlichen Tone fügte, so werde er auch diesmal abreisen müssen, ohne eine Entscheidung erreicht zu haben;
-- Каше блан, -- подхватил татарин.	X	'Wait a bit: you must take some sauce,' said Oblonsky, stopping Levin's hand that was pushing away the sauce-boat.	...” pensava.	daher beschloß er, sich dagegen aufzulehnen.
-- Ну, так этой марки к устрицам подай, а там видно будет.	Levin, al entrar en el restaurante con su amigo, no dejó de observar en él una expresión particular, una especie de alegría radiante y contenida que se manifestaba en el rostro y en toda la figura de Esteban Arkadievich.	Levin obediently helped himself to sauce, but would not let Oblonsky eat.	Nel veder Kitty che andava via e la madre che la raggiungeva sulle scale, Levin, tutto rosso ancora per il movimento brusco che aveva fatto, si fermò a riflettere.	»Aber das müssen Sie doch wissen!«
-- Слушаю	Oblonsky se quitó el abrigo y, con el sombrero ladeado, pasó al comedor, dando órdenes a los camareros tártaros que, vestidos de frac y con las servilletas bajo el brazo, le rodearon, pegándose materialmente a sus faldones.	'No, wait, wait!' he said.	Si tolse i pattini e raggiunse all’uscita madre e figlia.	»Nein, ich weiß es nicht.
-	Saludando alegremente a derecha a izquierda a los conocidos, que aquí como en todas partes le acogían alegremente, Esteban Arkadievich se dirigió al mostrador y tomó un vasito de vodka acompañándolo con un pescado en conserva, y dijo a la cajera francesa, toda cintas y puntillas, algunas frases que la hicieron reír a carcajadas.	'Understand that for me it is a question of life and death.	— Molto lieta di vedervi — disse la principessa.	Das wird von Ihnen abhängen«, versetzte er und erschrak sogleich über diese Antwort.
с.	En cuanto a Levin, la vista de aquella francesa, que parecía hecha toda ella de cabellos postizos y de poudre de riz y vinaigres de toilette8, le producía náuseas.	I have never spoken to any one about it, and can speak to no one else about it.	—	Ob sie nun seine Worte nicht gehört hatte oder nicht hatte hören wollen – sie schien zu straucheln, stampfte zweimal mit dem Füßchen auf und lief eilig von ihm fort.
Столового какого прикажете?	Se alejó de allí como pudiera hacerlo de un estercolero.	Now you and I are quite different in everything – in tastes and views and everything – but I know you like me and understand me, and so I am awfully fond of you.	Il giovedì, come sempre, riceviamo.	Sie lief zu Mademoiselle Linon hin, sagte ihr etwas und schlug dann die Richtung nach dem Häuschen ein, wo die Damen sich die Schlittschuhe an- und abschnallen ließen.
--	Su alma estaba llena del recuerdo de Kitty y en sus ojos brillaba una sonrisa de triunfo y de felicidad.	But for God's sake be quite frank with me!'	— Allora, oggi?	›Mein Gott, was habe ich getan!
Нюи подай.	–Por aquí, Excelencia, tenga la bondad.	'I am telling you what I think,' said Oblonsky smiling.	— Saremo molto lieti di vedervi — rispose asciutta la principessa.	Herr, mein Gott!
Нет, уж лучше классический шабли.	Aquí no importunará nadie a Su Excelencia –decía el camarero tártaro que con más ahínco seguía a Oblonsky y que era un hombre grueso, viejo ya, con los faldones del frac flotantes bajo la ancha cintura–.	'And I'll tell you something more.	Questo tono secco amareggiò Kitty, ed ella non poté trattenersi dall’attenuare la freddezza della madre.	Steh mir bei; gib mir ein, was ich tun soll!‹ betete Ljewin im stillen.
-- Слушаю	Haga el favor, Excelencia –decía asimismo a Levin, honrándolo también como invitado de Esteban Arkadievich.	My wife is a most wonderful woman...'	Girò la testa e con un sorriso disse:	Und da er gleichzeitig ein Bedürfnis nach starker Bewegung empfand, so nahm er einen Anlauf und beschrieb Spiralen nach außen und nach innen zu.
-	Colocó rápidamente un mantel limpio sobre la mesa redonda, ya cubierta con otro y colocada bajo una lámpara de bronce.	He sighed, remembering his relations with his wife; then after a minute's pause he continued: 'She has the gift of clairvoyance.	— A rivederci.	In diesem Augenblick trat ein junger Mann, der beste der neueren Schlittschuhläufer, mit einer Zigarette im Munde und Schlittschuhen an den Füßen aus dem Kaffeehäuschen heraus, nahm einen Anlauf und sprang auf den Schlittschuhen mit Gepolter die Treppenstufen hinab.
с.	Luego acercó dos sillas tapizadas y se paró ante Oblonsky con la servilleta y la carta en la mano, aguardando órdenes.	She sees people through and through!	In quel momento Stepan Arkad’ic, col cappello di traverso, il viso e gli occhi luccicanti, entrava nel giardino come un trionfatore.	Unten angelangt, glitt er, ohne auch nur die ungezwungene Haltung der Arme zu verändern, auf dem Eise dahin.
Сыру вашего прикажете?	–	But more than that, she knows what is going to happen especially in regard to marriages.	Ma, avvicinatosi alla suocera, rispose con viso contrito e confuso alle domande di lei sulla salute di Dolly.	»Aha, das ist ein neues Kunststück«, sagte Ljewin und lief sofort nach oben, um es gleichfalls auszuführen.
-- Ну да, пармезану.	Si Su Excelencia desea el reservado, podrá disponer de él dentro de poco.	For instance, she predicted that the Shahovskaya girl would marry Brenteln.	Dopo aver parlato a voce bassa e sommessa con la suocera, raddrizzò il torace e prese Levin sottobraccio.	»Brechen Sie sich nicht den Hals!
Или ты другой любишь?	Ahora lo ocupa el príncipe Galitzin con una dama...	No one would believe it, but as it turned out she was right.	— E allora, andiamo?	Das muß man geübt haben!« rief ihm Nikolai Schtscherbazki zu.
-- Нет, мне все равно, -- не в силах удерживать улыбки, говорил Левин.	Hemos recibido ostras francesas.	And she is on your side.'	— chiese.	Ljewin stieg die Stufen hinan, nahm oben einen möglichst großen Anlauf und sprang hinunter, wobei er sich bei der ungewohnten Bewegung mit den Armen im Gleichgewicht hielt.
И татарин с развевающимися фалдами над широким тазом побежал и через пять минут влетел с блюдом открытых на перламутровых раковинах устриц и с бутылкой между пальцами.	–¡Caramba, ostras!	'How do you know?'	— Non ho fatto che pensare a te e sono molto contento che tu sia venuto — disse, guardandolo negli occhi con aria significativa.	Bei der letzten Stufe strauchelte er;
Степан Аркадьич смял накрахмаленную салфетку, засунул ее себе за жилет и, положив покойно руки, взялся за устрицы.	Esteban Arkadievich reflexionó.	'In this way – she not only likes you, but says that Kitty is sure to be your wife.'	— Andiamo, andiamo — rispose felice Levin che non cessava di ascoltare il tono della voce che aveva detto “a rivederci” e di vedere il sorriso col quale le parole erano state dette.	jedoch berührte er das Eis dabei kaum mit der Hand;
-- А недурны, -- говорил он, сдирая серебряною вилочкой с перламутровой раковины шлюпающих устриц и проглатывая их одну за другой.	–	At these words a sudden smile brightened Levin's face, the kind of smile that is not far from tears of tenderness.	— All’“Inghilterra” o all’“Ermitage”?	durch eine kräftige Bewegung brachte er sich wieder in die Höhe und lief lachend auf den Schlittschuhen über die Eisfläche weiter.
-- Недурны, -- повторял он, вскидывая влажные и блестящие глаза то на Левина, то на татарина.	¿Cambiamos el plan, Levin? –preguntó, poniendo el dedo sobre la carta.	'She says that?' he cried.	— Per me è lo stesso.	›Ein lieber, prächtiger Mensch‹, dachte Kitty, die in diesem Augenblicke mit Mademoiselle Linon aus dem Häuschen heraustrat und mit einem stillen, freundlichen Lächeln nach ihm wie nach einem lieben Bruder hinblickte
Левин ел и устрицы, хотя белый хлеб с сыром был ему приятнее.	Y su rostro expresaba verdadera perplejidad.	'I have always thought her a jewel, your wife!	— Su, all'“Inghilterra” — disse Stepan Arkad’ic e scelse l’“Inghilterra” perché all’“Inghilterra” aveva un debito più grosso che non all’“Ermitage”, e riteneva suo dovere farsi vedere in quel ristorante.	.
Но он любовался на Облонского.	–¿Sabes si son buenas las ostras? –interrogó.	But enough – enough about it!'	— Hai una vettura?	›Bin ich wirklich schuld?
Даже татарин, отвинтивший пробку и разливавший игристое вино по разлатым тонким рюмкам, с заметною улыбкой удовольствия, поправляя свой белый галстук, поглядывал на Степана Аркадьича.	–De Flensburg, Excelencia.	and he got up.	Benissimo, perché ho rimandato indietro la mia.	Habe ich denn etwas Schlimmes getan?
-- А ты не очень любишь устрицы?	De Ostende no tenemos hoy.	'All right, but sit down!'	Per tutta la strada gli amici tacquero.	Die Leute reden immer von Gefallsucht.
-- сказал Степан Аркадьич, выпивая свой бокал, -- или ты озабочен?	–Pasemos porque sean de Flensburg, pero ¿son frescas?	But Levin could not sit still.	Levin pensava cosa potesse significare quel mutamento di espressione nel viso di Kitty, e ora rassicurava se stesso col dirsi che una speranza c’era, ora si abbandonava alla disperazione sembrandogli chiaro che la sua speranza fosse completamente insensata;	Ich weiß, daß ich ihn nicht liebe;
А?	–Las hemos recibido ayer.	He strode up and down the little cage of a room blinking to force back his tears, and only when he had succeeded did he sit down again.	intanto si sentiva tutto un altro uomo, non più simile a quello che era stato fino al sorriso di lei e fino alle parole “a rivederci”.	aber doch macht mir das Zusammensein mit ihm soviel Vergnügen, und er ist ein so prächtiger Mensch.
Ему хотелось, чтобы Левин был весел.	–¿Entonces empezamos por las ostras y cambiamos el plan?	'Try and realize,' he said, 'that this is not love.	Stepan Arkad’ic durante il percorso componeva la lista del pranzo.	Aber warum hat er das nur gesagt?‹
Но Левин не то что был не весел, он был стеснен.	–	I have been in love but this is not the same thing.	— Ti piace il rombo?	dachte sie.
С тем, что было у него в душе, ему жутко и неловко было в трактире, между кабинетами, где обедали с дамами, среди этой беготни и суетни; эта обстановка бронз, зеркал, газа, татар -- все это было ему оскорбительно.	Me es indiferente.	It is not my feeling but some external power that has seized me.	— disse a Levin quando furono giunti.	Als Ljewin sah, daß Kitty und ihre Mutter, die auf den Stufen mit ihr zusammengetroffen war, von der Eisbahn weggingen, blieb er, ganz rot von der schnellen Bewegung, stehen und überlegte.
Он боялся запачкать то, что переполняло его душу.	A mí lo que más me gustaría sería el schi y la kacha9, pero aquí no deben de tener de eso.	I went away, you know, because I had come to the conclusion that it was impossible – you understand?	—	Er schnallte die Schlittschuhe ab und holte Mutter und Tochter am Ausgange des Gartens ein.
-- Я?	–¿El señor desea kacha à la russe? –preguntó el tártaro, inclinándose hacia Levin como un aya hacia un niño.	Because such happiness does not exist on earth.	Che cosa?	»Ich freue mich sehr, Sie wiederzusehen«, sagte die Fürstin.
Да, я озабочен; но, кроме того, меня это все стесняет, -- сказал он.	–	But I have struggled with myself, and found that without that there's no life for me.	— domandò Levin.	»Unser Empfangstag ist immer noch der Donnerstag.«
-- Ты не можешь представить себе, как для меня, деревенского жителя, все это дико, как ногти того господина, которого я видел у тебя...	Bromas aparte, estoy conforme con lo que escojas –dijo Levin a Oblonsky–.	And it must be decided...'	— Il rombo?	»Also heute?«
-- Да, я видел, что ногти бедного Гриневича тебя очень заинтересовали, -- смеясь, сказал Степан Аркадьич.	He patinado mucho y tengo apetito.	'Then why did you go away?'	Ah, sì, mi piace straordinariamente il rombo.	»Wir werden sehr erfreut sein, Sie bei uns zu sehen«, erwiderte die Fürstin in trockenem Tone.
-- Не могу, -- отвечал Левин.	–	'Wait a moment!	X	Diesen trockenen Ton empfand Kitty peinlich, und sie konnte sich des Verlangens nicht erwehren, das kühle Wesen der Mutter wiedergutzumachen.
--	Y añadió, observando una expresión de descontento en el rostro de Esteban Arkadievich–: No creas que no sepa apreciar tu elección.	Oh, what a crowd of ideas!	Quando Levin entrò nel locale con Oblonskij, non poté fare a meno di notare una certa particolare espressione, come una vivacità contenuta nel viso e nella figura tutta di Stepan Arkad’ic.	Daher wandte sie den Kopf zu Ljewin zurück und sagte lächelnd:
Ты постарайся, войди в меня, стань на точку зрения деревенского жителя.	Estoy seguro de que comeré muy a gusto.	How many things I have to ask!	Oblonskij si tolse il cappotto e, col cappello calato da un lato, passò nella sala da pranzo, dando gli ordini ai tartari che gli si erano messi dietro, in frac e col tovagliolo sul braccio.	»Auf Wiedersehen!«
Мы в деревне стараемся привести свои руки в такое положение, чтоб удобно было ими работать; для этого обстригаем ногти, засучиваем иногда рукава.	–¡No faltaba más!	Listen.	Salutando a destra e a sinistra gli amici che si trovavano là e che lo salutavano dovunque con gioia, si avvicinò al banco, prese come antipasto vodka e pesce salato e disse qualcosa alla francese che sedeva alla cassa tutta pitturata e ricoperta di nastri, pizzi e ghirigori, in modo che anche questa si mise a ridere schiettamente.	Zu derselben Zeit war Stepan Arkadjewitsch, den Hut schief auf dem Kopfe, mit strahlendem Gesichte und blitzenden Augen, wie ein froher Sieger, im Garten erschienen.
А тут люди нарочно отпускают ногти, насколько они могут держаться, и прицепляют в виде запонок блюдечки, чтоб уж ничего нельзя было делать руками.	Digas lo que quieras, el comer bien es uno de los placeres de la vida –repuso Esteban Arkadievich–.	You can't imagine what you have done for me by saying what you did!	Levin non bevve la vodka solo perché gli dava fastidio quella francese che sembrava fatta di capelli finti, poudre de riz e vinaigre de toilette.	Aber als er seiner Schwiegermutter begegnete, beantwortete er mit trauriger, bedrückter Miene deren Fragen nach Dollys Gesundheit.
Степан Аркадьич весело улыбался.	Ea, amigo: tráenos primero las ostras.	I am so happy that I'm acting meanly.	Si allontanò in fretta da lei come da un luogo sudicio.	Er führte dieses Gespräch mit leiser Stimme und in niedergeschlagener Haltung;
-- Да, это признак того, что грубый труд ему не нужен.	Dos –no, eso sería poco–, tres docenas... Luego, sopa juliana...	I've forgotten everything.	L’animo suo era tutto pieno del ricordo di Kitty e nei suoi occhi splendeva un sorriso di trionfo e di felicità.	aber sobald die Damen weggefahren waren, richtete er sich wieder selbstbewußt auf und faßte Ljewin unter den Arm.
У него работает ум...	–Printanière, ¿no? –	I heard to-day about my brother Nicholas... he's here, you know... and I forgot all about him.	— Di qua, eccellenza, prego, qua nessuno disturberà vostra eccellenza — diceva un vecchio tartaro biancastro, che più degli altri gli si era appiccicato, con un vasto ventre che sporgeva tra le falde del frac aperte.	»Nun, wie ist's
-- Может быть.	corrigió el tártaro.	It seems to me as if he too were happy.	— Prego, eccellenza, — diceva a Levin, mostrando di occuparsi, in segno di deferenza verso Stepan Arkad’ic, anche dell’ospite.	?
Но все-таки мне дико, так же как мне дико теперь то, что мы, деревенские жители, стараемся поскорее наесться, чтобы быть в состоянии делать свое дело, а мы с тобой стараемся как можно дольше не наесться и для этого едим устрицы...	Pero Oblonsky no quería darle la satisfacción de mencionar los platos en francés.	It is like madness!	Dopo aver steso, in un batter d’occhio, una tovaglia di bucato su di un tavolo tondo già ricoperto di un’altra tovaglia, proprio sotto a un doppiere di bronzo, accostò le sedie di velluto e si piantò davanti a Stepan Arkad’ic col tovagliolo e la lista in mano, aspettando ordini.	Wollen wir fahren?« fragte er.
-- Ну, разумеется, -- подхватил Степан Аркадьич. --	–	But there is one awful thing about it.	— Se vostra eccellenza ordina un salottino separato, subito se ne farà uno libero:	»Ich habe fortwährend an dich gedacht und bin sehr froh, daß du hierher nach der Eisbahn gekommen bist«, sagte er und blickte ihm bedeutsam in die Augen.
Но в этом-то и цель образования: изо всего сделать наслаждение.	Sopa juliana, juliana, ¿entiendes?	You, who are married, know the feeling...	il principe Golycin con una signora.	»Schön, schön, fahren wir!« antwortete der glückliche Ljewin, dem immer noch so war, als höre er den Ton der Stimme, die zu ihm ›Auf Wiedersehen!‹ gesagt hatte, und als sähe er das Lächeln, mit dem diese Worte gesprochen worden waren.
-- Ну, если это цель, то я желал бы быть диким,	Luego rodaballo, con la salsa muy espesa; luego... rosbif, pero que sea bueno, ¿eh?	it is awful that we – who are comparatively old and have pasts... not of love but of sin...	Sono arrivate le ostriche fresche.	»Nach dem Hotel d'Angleterre oder nach der Eremitage?«
--	Después, pollo y algo de conservas.	suddenly we come into close intimacy with a pure innocent being!	— Ah, le ostriche!	»Mir ganz gleich.«
Ты и так дик...	El tártaro, recordando la costumbre de Oblonsky de no nombrar los manjares con los nombres de la cocina francesa, no quiso insistir, pero se tomó el desquite, repitiendo todo lo encargado tal como estaba escrito en la carta.	That is disgusting, and therefore one can't help feeling oneself unworthy.'	Stepan Arkad’ic si mise a pensare.	»Na, dann nach dem Hotel d'Angleterre«, entschied Stepan Arkadjewitsch.
Вы все Левины дики.	–Soupe printanière, turbot à la Beaumarchais, poularde à l'estragon, macedoine de fruits...	'Well, there haven't been many sins in your past!'	— Dobbiamo cambiare piano, Levin?	Er wählte dieses Restaurant deswegen, weil er da mehr schuldig war als in der Eremitage.
Левин вздохнул.	Y en seguida después, como movido por un resorte, cambió la carta que tenía en las manos por la de los vinos y la presentó a Oblonsky.	'Ah, but all the same,' said Levin, 'looking back at my life, I tremble and curse and bitterly regret... Yes!'	— disse fermando un dito sulla carta.	Aus diesem Grunde hielt er es für unpassend, dieses Hotel zu meiden.
Он вспомнил о брате Николае, и ему стало совестно и больно, и он нахмурился; но Облонский заговорил о таком предмете, который тотчас же отвлек его.	–¿Qué bebemos?	'What's to be done?	Il suo viso esprimeva seria perplessità.	»Hast du eine Droschke?
-- Ну что ж, поедешь нынче вечером к нашим, к Щербацким то есть? -- сказал он, отодвигая пустые шершавые раковины, придвигая сыр и значительно блестя глазами.	–Lo que quieras; acaso un poco de... champaña	That's the way the world is made,' said Oblonsky.	— Son buone le ostriche?	Das ist ja vortrefflich;
-- Да, я непременно поеду, -- отвечал Левин.	–indicó Levin.	"'My one consolation is that prayer that I like so much: ""Not according to my deserts but according to Thy mercy!"""	Bada, ve’!	ich habe nämlich meinen Wagen wieder nach Hause geschickt.«
--	–	And she too can only forgive me that way.'	— Di Flensburg, eccellenza, non di Ostenda.	Während der ganzen Fahrt schwiegen die beiden Freunde.
