Анна Каренина	Ana Karenina	Anna Karenina	Anna Karenina	Anna Karenina
Толстой Лев Николаевич	León Tolstoi	Leo Tolstoy	Lev Tolstoj	Lev Tolstoj
I	I	CHAPTER I	I	1.
Все счастливые семьи похожи друг на друга, каждая несчастливая семья несчастлива по-своему.	Todas las familias felices se parecen unas a otras; pero cada familia infeliz tiene un motivo especial para sentirse desgraciada.	ALL HAPPY FAMILIES resemble one another, but each unhappy family is unhappy in its own way.	Tutte le famiglie felici sono simili le une alle altre;	Alle glücklichen Familien sind einander ähnlich; aber jede unglückliche Familie ist auf ihre besondere Art unglücklich.
Все смешалось в доме Облонских.	En casa de los Oblonsky andaba todo trastrocado.	Everything was upset in the Oblonskys' house.	ogni famiglia infelice è infelice a modo suo.	Der ganze Haushalt der Familie Oblonski war in Unordnung geraten.
Жена узнала, что муж был в связи с бывшею в их доме француженкою-гувернанткой, и объявила мужу, что не может жить с ним в одном доме.	La esposa acababa de enterarse de que su marido mantenía relaciones con la institutriz francesa y se había apresurado a declararle que no podía seguir viviendo con él.	The wife had discovered an intrigue between her husband and their former French governess, and declared that she would not continue to live under the same roof with him.	Tutto era sottosopra in casa Oblonskij.	Die Hausfrau hatte erfahren, daß ihr Mann mit einer französischen Gouvernante, die sie früher im Hause gehabt hatten, ein Verhältnis unterhielt, und hatte ihm erklärt, sie könne nicht länger mit ihm unter einem Dache wohnen.
Положение это продолжалось уже третий день и мучительно чувствовалось и самими супругами, и всеми членами семьи, и домочадцами.	Semejante situación duraba ya tres días y era tan dolorosa para los esposos como para los demás miembros de la familia.	This state of things had now lasted for three days, and not only the husband and wife but the rest of the family and the whole household suffered from it.	La moglie era venuta a sapere che il marito aveva una relazione con la governante francese che era stata presso di loro, e aveva dichiarato al marito di non poter più vivere con lui nella stessa casa.	Drei Tage schon währte nun dieser Zustand, und er wurde sowohl von den Ehegatten selbst wie auch von den übrigen Familienmitgliedern und dem Hausgesinde als eine Qual empfunden.
Все члены семьи и домочадцы чувствовали, что нет смысла в их сожительстве и что на каждом постоялом дворе случайно сошедшиеся люди более связаны между собой, чем они, члены семьи и домочадцы Облонских.	Todos, incluso los criados, sentían la íntima impresión de que aquella vida en común no tenía ya sentido y que, incluso en una posada, se encuentran más unidos los huéspedes de lo que ahora se sentían ellos entre sí.	They all felt that there was no sense in their living together, and that any group of people who had met together by chance at an inn would have had more in common than they.	Questa situazione durava già da tre giorni ed era sentita tormentosamente dagli stessi coniugi e da tutti i membri della famiglia e dai domestici.	Alle Familienmitglieder und das Hausgesinde hatten das Gefühl, daß ihr Zusammenleben gar keinen Sinn mehr habe und daß in jeder Herberge die Leute, die sich dort zufällig zusammenfänden, in engerer Beziehung untereinander stünden als sie, die Mitglieder und das Gesinde der Familie Oblonski.
Жена не выходила из своих комнат, мужа третий день не было дома.	La mujer no salía de sus habitaciones; el marido no comía en casa desde hacía tres días; los niños corrían libremente de un lado a otro sin que nadie les molestara.	The wife kept to her own rooms, the husband stopped away from home all day; the children ran about all over the house uneasily, the English governess quarrelled with the housekeeper and wrote to a friend asking if she could find her another situation; the cook had gone out just at dinner-time the day before and had not returned; and the kitchen-maid and coachman had given notice	Tutti i membri della famiglia e i domestici sentivano che non c’era senso nella loro convivenza, e che della gente incontratasi per caso in una qualsiasi locanda sarebbe stata più legata fra di sé che non loro, membri della famiglia e domestici degli Oblonskij.	Die Hausfrau verließ ihr Zimmer nicht;
Дети бегали по всему дому, как потерянные; англичанка поссорилась с экономкой и написала записку приятельнице, прося приискать ей новое место; повар ушел еще вчера со двора, во время обеда; черная кухарка и кучер просили расчета.	La institutriz inglesa había tenido una disputa con el ama de llaves y escribió a una amiga suya pidiéndole que le buscase otra colocación; el cocinero se había ido dos días antes, precisamente a la hora de comer; y el cochero y la ayudante de cocina manifestaron que no querían continuar prestando sus servicios allí y que sólo esperaban que les saldasen sus haberes para irse.	.	La moglie non usciva dalle sue stanze;	der Hausherr war zwei Tage lang nicht nach Hause gekommen.
На третий день после ссоры князь Степан Аркадьич Облонский -- Стива, как его звали в свете, -- в обычный час, то есть в восемь часов утра, проснулся не в спальне жены, а в своем кабинете, на сафьянном диване...	El tercer día después de la escena tenida con su mujer, el príncipe Esteban Arkadievich Oblonsky –Stiva, como le llamaban en sociedad–, al despertar a su hora de costumbre, es decir, a las ocho de la mañana, se halló, no en el dormitorio conyugal, sino en su despacho, tendido sobre el diván de cuero.	On the third day after his quarrel with his wife, Prince Stephen Arkadyevich Oblonsky – Steve, as he was called in his set in Society – woke up at his usual time, eight o'clock, not in his wife's bedroom but on the morocco leather-covered sofa in his study.	il marito era già il terzo giorno che non rincasava.	Die Kinder liefen im ganzen Hause wie verloren umher;
Он повернул свое полное, выхоленное тело на пружинах дивана, как бы желая опять заснуть надолго, с другой стороны крепко обнял подушку и прижался к ней щекой; но вдруг вскочил, сел на диван и открыл глаза.	Volvió su cuerpo, lleno y bien cuidado, sobre los flexibles muelles del diván, como si se dispusiera a dormir de nuevo, a la vez que abrazando el almohadón apoyaba en él la mejilla.	He turned his plump, well-kept body over on the springy sofa as if he wished to have another long sleep, and tightly embracing one of the pillows leant his cheek against it; but then suddenly opened his eyes and sat up.	I bambini correvano per la casa abbandonati a loro stessi;	die englische Miß hatte sich mit der Wirtschafterin gezankt und einen Brief an eine Freundin geschrieben, ob sie ihr nicht eine andere Stelle verschaffen könne;
Да, да, как это было?	De repente se incorporó, se sentó sobre el diván y abrió los ojos.	'Let me see what was it?' he thought, trying to recall his dream.	la governante inglese si era bisticciata con la dispensiera e aveva scritto un biglietto ad un’amica chiedendo che le cercasse un posto;	der Koch war schon gestern vor dem Mittagessen davongegangen;
-- думал он, вспоминая сон.	«¿Cómo era», pensó, recordando su sueño.	'What was it?	il cuoco se n’era già andato via il giorno prima durante il pranzo;	die Küchenmagd und der Kutscher baten um ihren Lohn, um den Dienst zu verlassen.
-- Да, как это было?	«	Oh yes – Alabin was giving a dinner-party in Darmstadt – no, not in Darmstadt but somewhere in America.	sguattera e cocchiere avevano chiesto di essere liquidati.	Am dritten Tage nach dem Streite erwachte Fürst Stepan Arkadjewitsch Oblonski (Stiwa, wie er von seinen Bekannten genannt wurde) zur gewohnten Stunde, das heißt um acht Uhr morgens, aber nicht im gemeinsamen Schlafzimmer, sondern in seinem Arbeitszimmer auf dem Ledersofa.
Да!	¡A ver, a ver! Alabin daba una comida en Darmstadt...	Oh yes, Darmstadt was in America, – and Alabin was giving the party.	Tre giorni dopo il litigio, il principe Stepan Arkad’ic Oblonskij — Stiva, com’era chiamato in società — all’ora solita, cioè alle otto del mattino, si svegliò non nella camera della moglie, ma nello studio, sul divano marocchino.	Er wälzte seinen gut genährten und gepflegten Körper auf dem Sofa ein paarmal hin und her, als ob er noch weiterschlafen wolle, umfaßte das Kopfkissen fest von unten her und drückte die Wange dagegen;
Алабин давал обед в Дармштадте; нет, не в Дармштадте, а что-то американское.	Sonaba una música americana...	"The dinner was served on glass tables – yes, and the tables sang ""Il mio tesoro""... no, not exactly ""Il mio tesoro,"" but something better than that; and then there were some kind of little decanters that were really women.'"	Rigirò il corpo pienotto e ben curato sulle molle del divano, come se volesse riaddormentarsi di nuovo a lungo, rivoltò il cuscino, lo abbracciò forte e vi appoggiò la guancia;	plötzlich aber fuhr er in die Höhe, setzte sich auf dem Sofa aufrecht hin und öffnete die Augen.
Да, но там Дармштадт был в Америке.	El caso es que Darmstadt estaba en América...	His eyes sparkled merrily and he smiled as he sat thinking.	ma a un tratto fece un balzo, sedette sul divano e aprì gli occhi.	›Ja, ja, wie war das doch nur?‹ dachte er, indem er sich auf seinen Traum zu besinnen suchte.
Да, Алабин давал обед на стеклянных столах, да, -- и столы пели: Il mio tesoro, и не Il mio tesoro, а что-то лучше, и какие-то маленькие графинчики, и они же женщины, -- вспоминал он.	¡Eso es!	'Yes, it was very nice.	“Già già, com’è andata?	›Ja, wie war das doch nur?
Глаза Степана Аркадьича весело заблестели, и он задумался, улыбаясь.	Alabin daba un banquete, servido en mesas de cristal...	There were many other delightful things which I can't just get hold of – can't catch now I'm awake.'	— pensava riandando al sogno.	Ja!
"""Да, хорошо было, очень хорошо."	"Y las mesas cantaban: ""Il mio tesoro""..: Y si do era eso, era algo más bonito todavía. » Había también unos frascos, que luego resultaron ser mujeres...» Los ojos de Esteban Arkadievich brillaron alegremente al recordar aquel sueño."	Then, noticing a streak of light that had made its way in at the side of the blind, he gaily let down his legs and felt about with his feet for his slippers finished with bronze kid (last year's birthday present, embroidered by his wife); and from nine years' habit he stretched out his arm, without rising, towards where his dressing-gown usually hung in their bedroom.	— Già, com’è andata?	Alabin gab ein Diner in Darmstadt;
"Много еще там было отличного, да не скажешь словами и мыслями даже наяву не выразишь""."	Luego quedó pensativo y sonrió.	And then he suddenly remembered that, and why, he was not sleeping there but in his study.	Ecco... Alabin aveva dato un pranzo a Darmstadt;	nein, nicht in Darmstadt, es war irgendwo in Amerika.
И, заметив полосу света, пробившуюся сбоку одной из суконных стор, он весело скинул ноги с дивана, отыскал ими шитые женой (подарок ко дню рождения в прошлом году), обделанные в золотистый сафьян туфли и по старой, девятилетней привычке, не вставая, потянулся рукой к тому месту, где в спальне у него висел халат.	«¡Qué bien estaba todo!» Había aún muchas otras cosas magníficas que, una vez despierto, no sabía expresar ni con palabras ni con pensamientos.	The smile vanished from his face and he frowned.	no, non Darmstadt, ma qualcosa d’America.	Ja, aber Darmstadt lag dabei in Amerika.
И тут он вспомнил вдруг, как и почему он спит не в спальне жены, а в кабинете; улыбка исчезла с его лица, он сморщил лоб.	Observó que un hilo de luz se filtraba por las rendijas de la persiana, alargó los pies, alcanzó sus zapatillas de tafilete bordado en oro, que su mujer le regalara el año anterior con ocasión de su cumpleaños, y, como desde hacía nueve años tenía por costumbre, extendió la mano hacia el lugar donde, en el dormitorio conyugal, acostumbraba tener colocada la bata.	'Oh dear, dear, dear!' he groaned recalling what had happened.	Già, ma là, Darmstadt era in America.	Ja, Alabin gab ein Diner auf gläsernen Tischen, ja, – und da waren solche kleine Likörflaschen, die sangen: Il mio tesoro1, oder vielmehr nicht Il mio tesoro, sondern ein noch schöneres Lied, und auf einmal waren die Likörflaschen Weiber‹, erinnerte er sich.
Ах, ах, ах!	Sólo entonces se acordó de cómo y por qué se encontraba en su gabinete y no en la alcoba con su mujer; la sonrisa desapareció de su rostro y arrugó el entrecejo.	And the details of his quarrel with his wife, his inextricable position, and, worst of all, his guilt, rose up in his imagination.	Sì, sì, Alabin aveva dato un pranzo su tavoli di vetro, già, e i tavoli cantavano ‘Il mio tesoro’, eh no, non ‘Il mio tesoro’, ma qualcosa di meglio;	Stepan Arkadjewitschs Augen leuchteten fröhlich auf, und lächelnd überließ er sich seinen Gedanken.
Ааа!.. -- замычал он, вспоминая все, что было.	–¡Ay, ay, ay!	'No, she will never forgive me; she can't forgive me!	e c’erano poi certe piccole caraffe, ed anche queste erano donne” ricordava.	›Ja, schön war es, sehr schön.
И его воображению представились опять все подробности ссоры с женою, вся безвыходность его положения и мучительнее всего собственная вина его.	–se lamentó, acordándose de lo que había sucedido.	And the worst thing about it is, that it's all my own fault – my own fault; and yet I'm not guilty!	Gli occhi di Stepan Arkad’ic presero a brillare allegramente ed egli ricominciò a pensare sorridendo:	Es war auch sonst noch viel Vergnügliches dabei;
Да! она не простит и не может простить.	Y de nuevo se presentaron a su imaginación los detalles de la escena terrible; pensó en la violenta situación en que se encontraba y pensó, sobre todo, en su propia culpa, que ahora se le aparecía con claridad. –No, no me perdonará.	That's the tragedy of it!' he thought.	“Eh già, si stava bene, tanto bene.	aber wenn man aufgewacht ist, kann man es sich nicht mehr in Gedanken klarmachen und es nicht mit Worten ausdrücken.‹
И всего ужаснее то, что виной всему я, виной я, а не виноват.	¡Y lo malo es que yo tengo la culpa de todo.	'Oh dear, oh dear!' he muttered despairingly, as he recalled the most painful details of the quarrel.	Ottime cose là;	Und als er einen Lichtstreifen bemerkte, der sich an dem einen Fenster neben dem Stoffvorhang ins Zimmer stahl, hob er in heiterer Stimmung die Beine vom Sofa herunter, suchte mit ihnen nach den goldfarbenen Saffianpantoffeln, die ihm seine Frau gestickt und im vorigen Jahre zum Geburtstage geschenkt hatte, und streckte nach alter, neunjähriger Gewohnheit, ohne aufzustehen, die Hand nach der Stelle aus, wo im Schlafzimmer sein Schlafrock zu hängen pflegte.
В этом-то вся драма, -- думал он.	La culpa es mía, y, sin embargo, no soy culpable.	The worst moment had been when returning home from the theatre merry and satisfied, with an enormous pear in his hand for his wife, he did not find her in the drawing-room nor, to his great surprise, in the study, but at last saw her in her bedroom with the unlucky note which had betrayed him in her hand.	ma prova un po’ a parlarne e a pensarne;	Dabei kam es ihm auf einmal zum Bewußtsein, daß und warum er nicht in dem gemeinsamen Schlafzimmer geschlafen hatte, sondern in seinem Arbeitszimmer;
-- Ах, ах, ах! -- приговаривал он с отчаянием, вспоминая самые тяжелые для себя впечатления из этой ссоры.	Eso es lo terrible del caso!	She sat there: the careworn, ever-bustling, and (as he thought) rather simple Dolly – with the note in her hand and a look of terror, despair, and anger on her face.	da sveglio neanche arrivi a dirle”.	das Lächeln verschwand von seinem Gesichte, und er runzelte die Stirn.
Неприятнее всего была та первая минута, когда он, вернувшись из театра, веселый и довольный, с огромною грушей для жены в руке, не нашел жены в гостиной; к удивлению, не нашел ее и в кабинете и, наконец, увидал ее в спальне с несчастною, открывшею все, запиской в руке.	¡Ay, ay, ay!	'What is this?	E, notata una striscia di luce che filtrava da un lato della cortina di panno, sporse allegramente i piedi fuori dal divano, cercò con essi le pantofole di marocchino dorato ricamategli dalla moglie (dono per l’ultimo suo compleanno), e per vecchia abitudine, ormai di nove anni, senza alzarsi, allungò il braccio verso il posto dove, nella camera matrimoniale, era appesa la vestaglia.	»Ach, o weh, o weh
Она, эта вечно озабоченная, и хлопотливая, и недалекая, какою он считал ее, Долли, неподвижно сидела с запиской в руке и с выражением ужаса, отчаяния и гнева смотрела на него.	–se repitió con desesperación, evocando de nuevo la escena en todos sus detalles.	This?' she asked, pointing to the note.	E in quel momento, a un tratto, ricordò come e perché non dormiva nella camera della moglie, ma nello studio, il sorriso gli sparve dal volto;	!« stöhnte er, da ihm alles Vorgefallene wieder ins Gedächtnis kam.
-- Что это?	Lo peor había sido aquel primer momento, cuando al regreso del teatro, alegre y satisfecho con una manzana en las manos para su mujer, no la había hallado en el salón; asustado, la había buscado en su gabinete, para encontrarla al fin en su dormitorio examinando aquella malhadada carta que lo había descubierto todo.	And, as often happens, it was not so much the memory of the event that tormented him, as of the way he had replied to her.	corrugò la fronte.	Und vor seinem geistigen Blicke erschienen wieder alle Einzelheiten seines Streites mit seiner Frau und die ganze Mißlichkeit seiner Lage und, was ihn am allermeisten quälte, seine eigene Schuld.
это? -- спрашивала она, указывая на записку.	Dolly, aquella Dolly, eternamente ocupada, siempre llena de preocupaciones, tan poco inteligente, según opinaba él, se hallaba sentada con el papel en la mano, mirándole con una expresión de horror, de desesperación y de ira.	At that moment there had happened to him what happens to most people when unexpectedly caught in some shameful act: he had not had time to assume an expression suitable to the position in which he stood toward his wife now that his guilt was discovered.	— Ahi, ahi, ahi!	›Ja, das wird sie nicht verzeihen und kann sie nicht verzeihen.
И при этом воспоминании, как это часто бывает, мучала Степана Аркадьича не столько самое событие, сколько то, как он ответил на эти слова жены.	–¿Qué es esto? ¿Qué me dices de esto?	Instead of taking offence, denying, making excuses, asking forgiveness, or even remaining indifferent (anything would have been better than what he did), he involuntarily ('reflex action of the brain,' thought Oblonsky, who was fond of physiology) smiled his usual kindly and therefore silly smile.	— mugolò, ricordando quanto era accaduto, e gli si presentarono di nuovo alla mente tutti i particolari del litigio, la situazione senza via di uscita e, più tormentosa di tutto, la propria colpa.	Und das Schauderhafteste dabei ist, daß ich selbst an alledem schuld bin;
С ним случилось в эту минуту то, что случается с людьми, когда они неожиданно уличены в чем-нибудь слишком постыдном.	–preguntó, señalando la carta.	He could not forgive himself for that silly smile.	“Già, lei non perdonerà, non può perdonare.	– ich bin an alledem schuld und kann doch eigentlich nichts dafür.
Он не сумел приготовить свое лицо к тому положению, в которое он становился перед женой после открытия его вины.	Y ahora, al recordarlo, lo que más contrariaba a Esteban Arkadievich en aquel asunto no era el hecho en sí, sino la manera como había contestado entonces a su esposa.	Dolly, seeing it, shuddered as if with physical pain, and with her usual vehemence burst into a torrent of cruel words and rushed from the room.	E quel ch’è peggio è che la colpa di tutto è mia... la colpa è mia, eppure non sono colpevole!	Das ist das Tragische bei der Sache‹, dachte er.
Вместо того чтоб оскорбиться, отрекаться, оправдываться, просить прощения, оставаться даже равнодушным -- все было бы лучше того, что он сделал! --	Le había sucedido lo que a toda persona sorprendida en una situación demasiado vergonzosa: no supo adaptar su aspecto a la situación en que se encontraba.	Since then she had refused to see him.	Proprio in questo sta il dramma” pensava.	»O weh, o weh!« sagte er verzweifelt vor sich hin, in Erinnerung an jene Einzelheiten des Streites, die auf ihn den stärksten Eindruck gemacht hatten.
"его лицо совершенно невольно (""рефлексы головного мозга"", -- подумал Степан Аркадьич, который любил физиологию), совершенно невольно вдруг улыбнулось привычною, доброю и потому глупою улыбкой."	Así, en vez de ofenderse, negar, disculparse, pedir perdón o incluso permanecer indiferente ––cualquiera de aquellas actitudes habría sido preferible–, hizo una cosa ajena a su voluntad («reflejos cerebrales» , juzgó Esteban Arkadievich, que se interesaba mucho por la fisiología): sonreír, sonreír con su sonrisa habitual, benévola y en aquel caso necia.	'It's all the fault of that stupid smile,' thought Oblonsky.'	“Ahi, ahi, ahi!” ripeteva con disperazione, ricordando le impressioni più penose per lui di quella rottura.	Am unangenehmsten war jener erste Augenblick gewesen, als er, heiter und zufrieden aus dem Theater heimkehrend, seine Frau, für die er eine gewaltig große Birne in der Hand trug, zu seinem Erstaunen weder im Salon noch in ihrem Zimmer vorgefunden und endlich im Schlafzimmer erblickt hatte, in der Hand den unglückseligen Brief, der alles verraten hatte.
Эту глупую улыбку он не мог простить себе.	Aquella necia sonrisa era imperdonable.	But what am I to do? What can I do?' he asked himself in despair, and could find no answer.	Più spiacevole di tutto il primo momento, quando, tornato da teatro, allegro e soddisfatto, con un’enorme pera in mano per la moglie, non l’aveva trovata nel salotto;	Sie, die sonst stets sorglich geschäftige und seiner Ansicht nach etwas beschränkte Dolly, hatte mit dem Briefe in der Hand regungslos dagesessen und den Eintretenden mit einer Miene des Schreckens, der Verzweiflung und des Zornes angeblickt.
