Анна Каренина	Ana Karenina	Anna Karenina	Anna Karenina	Anna Karenina
-- Что, Вавилон исправился или вы испортились? -- прибавила она, с усмешкой оглядываясь на Кити.	La Princesa se hallaba aún en su cuarto y el Príncipe no había bajado tampoco.	'Wait a bit! Do I draw them on?	Quel giorno con l’apparire di Levin le si era aggiunta una nuova inquietudine.	aber jetzt fühlte sie, daß zu der Peinlichkeit, wie sie der Fürst an den Tag legte, mehr Grund vorhanden sei.
-- Мне очень лестно, графиня, что вы так помните мои слова, -- отвечал Левин, умевший оправиться и сейчас же по привычке входя в свое шуточное отношение к графине Нордстон.	«Ahora...»,	No, certainly not, but a young man and an excellent young man falls in love with Kitty, and she too seems...'	Temeva che la figlia, che pur un tempo — così le era parso — aveva avuto della simpatia per Levin, rifiutasse per troppa onestà Vronskij, e temeva che, per un insieme di cose, l’arrivo di Levin non avesse a confondere e a ostacolare un affare già così prossimo alla conclusione.	Sie sah, daß sich in der letzten Zeit gar manches in den Gebräuchen der Gesellschaft geändert hatte und die Pflichten einer Mutter noch schwerer geworden waren.
--	pensó Kitty, sintiendo que la sangre le afluía al corazón.	'Seems indeed!	— Ma è molto che è arrivato?	Sie sah, daß Kittys Altersgenossinnen allerlei Vereine bildeten, allerlei Vorlesungen besuchten, mit Männern in freierer Form umgingen, ohne Begleitung durch die Stadt fuhren, großenteils den Knicks abgeschafft hatten und, was die Hauptsache war, alle fest davon überzeugt waren, daß die Wahl eines Gatten für sie ihre eigene Angelegenheit, nicht die der Eltern sei.
Верно, они на вас очень сильно действуют.	Se miró al espejo y se asustó de su propia palidez.	And suppose she really falls in love with him while he intends to marry about as much as I do...	— disse, accennando a Levin, la principessa nel tornare a casa.	›Heutzutage geht es bei der Eheschließung nicht mehr so zu wie früher‹, dachten und sagten alle diese jungen Mädchen und sogar alle älteren Leute.
-- Ах, как же!	Ahora comprendía claramente que si él había llegado tan pronto era para encontrarla sola y pedir su mano.	Oh, I wish my eyes had never seen it...	— Oggi, maman.	Aber wie man es heutzutage mit der Verheiratung der Töchter zu halten habe, das konnte die Fürstin von niemandem in Erfahrung bringen.
Я все записываю.	Y el asunto se le presentó de repente bajo un nuevo aspecto.	"""Ah spiritualism!"	— Io voglio dire una cosa sola... — cominciò la principessa e dal suo viso serio e animato, Kitty indovinò su quale argomento sarebbe scivolato il discorso.	Die französische Sitte, bei der die Eltern über das Schicksal der Kinder entscheiden, hatte in Rußland keinen Eingang gefunden und wurde so gut wie allgemein verworfen.
Ну что, Кити, ты опять каталась на коньках?..	No se trataba ya de ella sola, ni de saber con quién podría ser feliz y a quién daría su preferencia; comprendía ahora que era forzoso herir cruelmente a un hombre a quien amaba.	Ah how nice!	— Mamma — disse, avvampando in viso e volgendosi con vivacità.	Die englische Sitte, den jungen Mädchen völlige Freiheit zu lassen, war gleichfalls nicht angenommen worden und erschien in der russischen Gesellschaft als unmöglich.
И она стала говорить с Кити.	Y ¿por qué?	"Ah the ball!""-'"	— Vi prego, vi prego, non mi parlate di questo.	Und die russische Sitte der Heiratsvermittelung galt als abgeschmackt, und alle machten sich darüber lustig, auch die Fürstin selbst.
Как ни неловко было Левину уйти теперь, ему все-таки легче было сделать эту неловкость, чем остаться весь вечер и видеть Кити, которая изредка взглядывала на него и избегала его взгляда.	¡Porque él, tan agradable, estaba enamorado de ella!	And the Prince imagining himself to be impersonating his wife curtsied at each word.	Io so, so tutto.	Wie nun aber die Töchter und die Eltern sich in dieser wichtigen Sache zu verhalten hatten, das wußte kein Mensch zu sagen.
Он хотел встать, но княгиня, заметив, что он молчит, обратилась к нему:	Pero ella nada podía hacer: las cosas tenían que ser así.	'And then if we really ruin Kitty's happiness, if she really gets it into her head...'	Desiderava la stessa cosa che desiderava la madre;	Alle, mit denen die Fürstin darüber ins Gespräch kam, sagten zu ihr nur:
-- Вы надолго приехали в Москву?	«¡Dios mío! ¡Que yo misma tenga que decírselo!	'But why do you suppose such a thing?'	ma i motivi del desiderio materno la offendevano.	»Aber ich bitte Sie, in unserer Zeit ist es doch wahrhaftig angezeigt, diesen veralteten Brauch aufzugeben.
Ведь вы, кажется, мировым земством занимаетесь, и вам нельзя надолго.	–pensó–.	'I don't suppose, I know!	— Io voglio dire solo che, dopo aver incoraggiato uno...	Die jungen Leute sollen ja die Ehe eingehen und nicht die Eltern;
-- Нет, княгиня, я не занимаюсь более земством, -- сказал он.	¿Tendré que decirle que no le quiero?	We have eyes for those things, and women haven't.	— Mamma, amore mio, in nome di Dio, non parlate.	also muß man auch die jungen Leute sich versorgen lassen, wie sie selbst wollen.«
--	¡Pero esto no sería verdad!	I can recognize a man who has serious intentions – such as Levin – and I can see through a weathercock like that popinjay who only wishes to amuse himself.'	Fa così paura parlare di questo.	Aber die, die keine Töchter hatten, konnten leicht so reden;
Я приехал на несколько дней.	¿Que amo a otro?	'Oh well, when you once get a thing into your head...'	— Non ne parlerò — disse la madre vedendo le lacrime negli occhi della figlia.	die Fürstin dagegen mußte sich sagen, daß bei freier Möglichkeit der Annäherung ihre Tochter sich auch in einen Mann verlieben könne, der gar nicht beabsichtigte, sie zu heiraten, oder auch in einen solchen, der nicht zum Gatten für sie tauge.
Что-то с ним особенное, -- подумала графиня Нордстон, вглядываясь в его строгое, серьезное лицо, -- что-то он не втягивается в свои рассуждения.	¡Eso es imposible!	'And you'll find it out, but too late, just as with poor Dolly.'	—	Und mochte man auch der Fürstin mit noch so starken Gründen zu beweisen suchen, daß in unserer Zeit die jungen Leute sich ihr Schicksal selbst gestalten müßten, sie vermochte das ebensowenig zu glauben, wie sie hätte glauben können, daß irgendwann in Zukunft für fünfjährige Kinder das beste Spielzeug geladene Pistolen wären.
Но я уж выведу его.	Me voy, me voy...	'All right.	Ma una cosa sola, figliuola mia:	Und daher beunruhigte sich die Fürstin um Kitty mehr, als sie es bei ihren älteren Töchtern getan hatte.
Ужасно люблю сделать его дураком пред Кити, и сделаю.	» Ya iba a salir cuando sintió los pasos de él.	All right, don't let's talk,' said the Princess, interrupting him and remembering the unfortunate Dolly.	tu mi hai promesso che non avrai segreti per me.	Jetzt fürchtete sie, Wronski könnte sich darauf beschränken, ihrer Tochter lediglich die Kur zu machen.
-- Константин Дмитрич, -- сказала она ему, -- растолкуйте мне, пожалуйста, что такое значит, -- вы все это знаете, -- у нас в калужской деревне все мужики и все бабы все пропили, что у них было, и теперь ничего нам не платят.	«No, no es correcto que me vaya.	'Very well then, good-night.'	Vero?	Sie sah, daß Kitty sich bereits in ihn verliebt hatte;
Что это значит?	¿Y por qué temer?	And having made the sign of the cross over one another and kissed, feeling that each of them retained their individual opinions, the couple separated for the night.	— Mai, mamma, nessuno, — rispose Kitty, arrossendo e guardando dritto in faccia alla madre.	aber sie tröstete sich damit, daß er ein Ehrenmann sei und sich deshalb ein solches Verhalten nicht werde zuschulden kommen lassen.
Вы так хвалите всегда мужиков.	¿Qué he hecho de malo?	The Princess had been at first firmly convinced that this evening had decided Kitty's fate and that there could be no doubt as to Vronsky's intentions; but her husband's words disturbed her, and when she reached her room, in terror of the uncertainty of the future, she mentally repeated, just as Kitty had done: 'Lord have mercy, Lord have mercy, Lord have mercy!'	— Ma ora non ho nulla da dire.	Aber zugleich entging ihr nicht, wie leicht es bei der heutigen Freiheit des Verkehrs sei, einem jungen Mädchen den Kopf zu verdrehen, und wie leichtfertig im allgemeinen die Männer über eine solche Schuld denken.
В это время еще дама вошла в комнату, и Левин встал.	Le diré la verdad y no me sentiré cohibida ante él.	CHAPTER XVI	Io...io se volessi, non so, cosa dire e come...non so...	In der vergangenen Woche hatte Kitty ihrer Mutter ein Gespräch erzählt, das sie mit Wronski bei einer Masurka gehabt hatte.
-- Извините меня, графиня, но я, право, ничего этого не знаю и ничего не могу вам сказать, -- сказал он и оглянулся на входившего вслед за дамой военного.	Sí, es mejor que pase...	VRONSKY HAD NEVER KNOWN FAMILY LIFE.	«No, non può mentire con questi occhi» pensò la madre, sorridendo di quell’agitazione e di quella felicità.	Durch das Gehörte hatte sich die Fürstin allerdings teilweise beruhigt gefühlt;
Это должен быть Вронский, -- подумал Левин и, чтоб убедиться в этом, взглянул на Кити.	Ya está aquí», se dijo al distinguir la pesada y tímida figura que la contemplaba con ojos ardientes.	His mother in her youth had been a brilliant Society woman, and during her married life and especially in her widowhood had had many love affairs, known to everybody.	La principessa sorrideva perché capiva come appariva grande e importante a lei, poverina, quello che accadeva nell’animo suo.	aber ganz ruhig vermochte sie nicht zu sein.
Она уже успела взглянуть на Вронского и оглянулась на Левина.	Kitty le miró a la cara como si implorase su clemencia, y le dio la mano.	He hardly remembered his father, and had been educated in the Cadet Corps.	XIII	Wronski hatte zu Kitty gesagt, er und sein Bruder seien beide so daran gewöhnt, sich in allen Stücken ihrer Mutter unterzuordnen, daß sie nie etwas Wichtiges unternehmen würden, ohne vorher ihren Rat eingeholt zu haben.
И по одному этому взгляду невольно просиявших глаз ее Левин понял, что она любила этого человека, понял так же верно, как если б она сказала ему это словами.	–	On leaving that Corps as a very young and brilliant officer he at once joined the swim of the wealthy military Petersburg set.	Kitty, dopo pranzo e fino al principio della serata, provò una sensazione simile a quella che prova un giovane prima del combattimento.	»Auch jetzt erwarte ich die Ankunft meiner Mutter aus Petersburg wie ein besonderes Glück«, hatte er gesagt.
Но что же это за человек?	Veo que he llegado demasiado pronto ––dijo Levin, examinando el salón vacío.	Though he occasionally went into the highest Petersburg Society, all his love interests lay outside it.	Il cuore le batteva forte e il pensiero non riusciva a fermarsi su nulla.	Kitty hatte das ihrer Mutter erzählt, ohne diesen Worten besondere Bedeutung beizumessen.
Теперь, -- хорошо ли это, дурно ли, -- Левин не мог не остаться, ему нужно было узнать, что за человек был тот, кого она любила.	Y cuando comprobó que, como esperara, nada dificultaría sus explicaciones, su rostro se ensombreció.	In Moscow, after this luxurious course of Petersburg life, he experienced for the first time the delight of intimacy with a sweet, innocent Society girl who fell in love with him.	Sentiva che quella sera, quando i due uomini si sarebbero incontrati per la prima volta, si sarebbe decisa la sua sorte.	Aber die Mutter faßte es anders auf.
Есть люди, которые, встречая своего счастливого в чем бы то ни было соперника, готовы сейчас же отвернуться от всего хорошего, что есть в нем, и видеть в нем одно дурное; есть люди, которые, напротив, более всего желают найти в этом счастливом сопернике те качества, которыми он победил их и ищут в нем со щемящею болью в сердце одного хорошего.	–¡Oh, no! –contestó Kitty, sentándose junto a una mesa.	It never entered his head that there could be any wrong in his relations with Kitty.	E se li raffigurava continuamente, ora distinti, ora tutti e due insieme.	Sie wußte, daß die Ankunft der alten Gräfin von Tag zu Tag erwartet wurde, und wußte, daß diese über die von ihrem Sohne getroffene Wahl erfreut sein werde;
Левин принадлежал к таким людям.	–En realidad, deseaba encontrarla sola –explicó él, sin sentarse y sin mirarla, para no perder el valor.	At balls he danced chiefly with her and he visited her at her home.	Quando pensava al passato, con gioia e tenerezza si fermava sui ricordi dei suoi rapporti con Levin.	sie wunderte sich freilich, daß er aus Furcht, seine Mutter zu kränken, bisher noch keinen Antrag gemacht hatte;
Но ему нетрудно было отыскать хорошее и привлекательное во Вронском.	–Mamá vendrá en seguida.	He talked with her the usual Society talk: all sorts of rubbish, but rubbish into which involuntarily he put a special meaning for her.	I ricordi d’infanzia e l’amicizia di Levin col suo fratello morto davano un particolare poetico incanto ai suoi rapporti con lui.	jedoch wünschte sie so sehnlich sowohl diese Ehe selbst wie auch in allererster Linie endlich die Befreiung von all diesen Sorgen und Unruhen, daß sie an die in Wronskis Worten anscheinend liegende Begründung seines Verhaltens glaubte.
Оно сразу бросилось ему в глаза.	Ayer se cansó mucho...	Though he never said anything to her which could not have been said before everybody he was conscious that she was becoming more and more dependent upon him, and the more he felt this the pleasanter it was, and the more tender became his feelings toward her.	Il suo amore per lei, di cui era sicura, la lusingava e rallegrava.	Wie schmerzlich es auch jetzt für die Fürstin war, das Unglück ihrer ältesten Tochter Dolly mit ansehen zu müssen, die eine Trennung von ihrem Manne vorhatte, so drängte doch die Aufregung über das demnächst sich entscheidende Schicksal der jüngsten Tochter alle anderen Gefühle bei ihr zurück.
Вронский был невысокий, плотно сложенный брюнет, с добродушно-красивым, чрезвычайно спокойным и твердым лицом.	Ayer...	He did not know that his behaviour toward Kitty had a name of its own, that it was decoying a girl with no intentions of marrying her, and is one of the evil actions common among brilliant young men like himself.	E le era naturale pensare a Levin.	Der heutige Tag hatte ihr durch Ljewins plötzliches Wiedererscheinen eine neue Beunruhigung gebracht.
В его лице и фигуре, от коротко обстриженных черных волос и свежевыбритого подбородка до широкого с иголочки нового мундира, все было просто и вместе изящно.	Hablaba sin saber lo que decía y sin separar de Levin su mirada suplicante y acariciadora.	He thought he was the first to discover this pleasure and he enjoyed his discovery.	Al pensiero di Vronskij invece si frammischiava un certo impaccio, pur essendo egli un perfetto e sereno uomo di mondo;	Sie fürchtete, daß ihre Tochter, die früher, wie es ihr vorgekommen war, gegen Ljewin eine freundliche Gesinnung gehegt hatte, aus übertriebener Ehrlichkeit Wronski einen Korb geben und überhaupt Ljewins Ankunft die dem Abschluß schon so nahe Angelegenheit verwirren oder verzögern könnte.
Дав дорогу входившей даме, Вронский подошел к княгине и потом к Кити.	Él volvió a contemplarla.	If he could have heard what her parents said that night, if he could have known her family's point of view and learnt that Kitty would be unhappy if he did not marry her, he would have been much surprised and would not have believed it.	sembrava esserci una certa falsità, non in lui — era molto semplice e cortese — ma piuttosto in lei;	»Ist er schon vor längerer Zeit angekommen?« fragte die Fürstin mit Bezug auf Ljewin, als sie nach Hause zurückfuhren.
В то время как он подходил к ней, красивые глаза его особенно нежно заблестели, и с чуть заметною счастливою и скромно-торжествующею улыбкой (так показалось Левину), почтительно и осторожно наклонясь над нею, он протянул ей свою небольшую, но широкую руку.	Kitty se ruborizó y guardó silencio.	He would not have believed that what gave so much and such excellent pleasure to him, and – what was more – to her, could be wrong.	mentre con Levin si sentiva completamente spontanea e serena.	»Heute, maman.«
Со всеми поздоровавшись и сказав несколько слов, он сел, ни разу не взглянув на не спускавшего с него глаз Левина.	–Le dije ya que no sé cuánto tiempo permaneceré en Moscú, que la cosa dependía de usted.	Every less could he have believed that he ought to marry.	Ma intanto, quando pensava all’avvenire con Vronskij, le si presentava un luminoso sfondo di felicità;	»Ich möchte dir nur das eine sagen ...«, begann die Fürstin, und an ihrem ernsten, eine lebhafte Erregung bekundenden Gesichte erriet Kitty, wovon die Rede sein sollte.
-- Позвольте вас познакомить, -- сказала княгиня, указывая на Левина.	Ella inclinó más aún la cabeza no sabiendo cómo habría de contestar a la pregunta que presentía.	Marriage had never presented itself to him as a possibility.	mentre con Levin l’avvenire si presentava nebbioso.	»Mama«, sagte sie, indem sie sich schnell zu ihr hinwandte und blutrot wurde, »bitte, bitte, sprechen Sie nicht von dieser Sache
--	–	Not only did he dislike family life, but in accordance with the views generally held in the bachelor world in which he lived he regarded the family, and especially a husband, as something alien, hostile, and above all ridiculous.	Salita in camera per indossare l’abito da sera, gettò un’occhiata allo specchio, e si accorse con gioia che era in una delle sue giornate migliori, nel pieno possesso di tutte le sue attrattive, e questo le era tanto necessario per quello che stava per avvenire.	!
Константин Дмитрич Левин.	Depende de usted porque quería... quería decirle que... desearía que fuese usted mi esposa.	But although Vronsky had no suspicion of what Kitty's parents were saying, he felt, as he left the Shcherbatskys' house that night, that the secret spiritual bond which existed between him and Kitty had so strengthened during the evening that some action ought to be taken.	Sentiva in sé la calma esteriore e la libera grazia dei movimenti.	Ich weiß alles, alles weiß ich!«
Граф Алексей Кириллович Вронский.	Había hablado casi inconscientemente.	But what this should or could be he could not imagine.	Alle sette e mezzo, appena discesa in salotto, il cameriere annunciò:	Sie wünschte dasselbe, was die Mutter wünschte;
Вронский встал и, дружелюбно глядя в глаза Левину, пожал ему руку.	Al darse cuenta de que lo más grave había sido dicho, calló y miró a la joven.	'That's what is so delightful,' he thought as he left the Shcherbatskys' house, carrying away from there, us usual, a pleasant feeling of purity and freshness (partly due to the fact that he had not smoked at all that evening) and deeply touched by a new sense of tender joy in the consciousness of her love for him.	“Konstantin Dmitric Levin”.	aber die Gründe, die die Mutter zu diesem Wunsche veranlaßten, versetzten sie in Entrüstung.
-- Я нынче зимой должен был, кажется, обедать с вами, -- сказал он, улыбаясь своею простою и открытою улыбкой, -- но вы неожиданно уехали в деревню.	Ella respiraba con dificultad, apartando la vista.	'That is what is so delightful, that nothing was said either by me or by her, yet we so well understand one another in that subtle language of looks and tones that to-day more plainly than ever she has told me that she loves me.	La principessa era ancora in camera sua e il principe non era uscito fuori.	»Ich wollte nur sagen, nachdem du dem einen Hoffnung gemacht hast ...«
--	En el fondo se sentía alegre y su alma rebosaba felicidad.	And how sweetly, simply, and above all trustfully! I feel myself better and purer, I feel I have a heart and that there is much that is good in me.	“Ci siamo” pensò Kitty, e tutto il sangue le affluì al cuore.	»Mama, liebste Mama, ich bitte Sie inständig, sprechen Sie nicht davon!
Константин Дмитрич презирает и ненавидит город и нас, горожан, -- сказала графиня Нордстон.	Nunca había creído que tal declaración pudiera producirle una impresión tan profunda.	"Those dear loving eyes! when she said, ""and very much."""	Nel guardarsi allo specchio ebbe paura del proprio pallore.	Es ist so schrecklich, davon zu sprechen.«
-- Должно быть, мои слова на вас сильно действуют, что вы их так помните, -- сказал Левин и, вспомнив, что он уже сказал это прежде, покраснел.	Pero aquello duró un solo instante.	'Well, and what of it?	Ormai sapeva con certezza che egli era venuto prima proprio per trovarla sola e farle la sua proposta di matrimonio.	»Nun, nun, dann will ich es lassen«, erwiderte die Mutter, als sie Tränen in Kittys Augen sah.
Вронский взглянул на Левина и графиню Нордстон и улыбнулся.	Recordó a Vronsky y, dirigiendo a Levin la mirada de sus ojos límpidos y francos y viendo la expresión desesperada de su rostro, dijo precipitadamente.	Nothing, of course.	E allora soltanto, per la prima volta, la cosa le apparve sotto un aspetto completamente nuovo, diverso.	»Nur eines, mein Herzchen: du hast mir versprochen, keine Geheimnisse vor mir zu haben.
-- А вы всегда в деревне?	–Dispénseme... No es posible...	It's pleasant for me and for her,' and he considered where he should finish his evening.	Ora soltanto lei capiva che la questione non riguardava lei sola:	Wirst du deinem Versprechen treu bleiben?«
-- спросил он.	¡Qué próxima estaba ella a él un momento antes y cuán necesaria era para su vida!	He passed in review the places he might go to.	con chi sarebbe stata felice e chi amava, ma che in quel momento lei avrebbe dovuto offendere un uomo a cui voleva bene.	»Niemals werde ich Ihnen etwas verheimlichen, Mama, nichts, nichts!«
--	Y ahora, ¡qué lejana, qué distante de él!	'The Club: a game of bezique, a bottle of champagne with Ignatev?	E offenderlo crudamente... Perché?	antwortete Kitty errötend und blickte der Mutter gerade in die Augen.
Я думаю, зимой скучно?	–	No, I won't go there.	Perché lui, povero caro, l’amava, era innamorato di lei.	»Aber ich habe Ihnen jetzt nichts mitzuteilen ...
-- Не скучно, если есть занятия, да и с самим собой не скучно, -- резко ответил Левин.	No podía ser de otro modo –dijo Levin, sin mirarla.	Chateau des Fleurs?	Ma non c’era nulla da fare;	Ich ... ich ... beim besten Willen weiß ich nicht, was ich Ihnen sagen könnte, und wie ... ich weiß nicht ...«
