Анна Каренина	Ana Karenina	Anna Karenina	Anna Karenina	Anna Karenina
Я сейчас приехал, и очень хотелось тебя видеть, -- отвечал Левин, застенчиво и вместе с тем сердито и беспокойно оглядываясь вокруг.	Levin no era un «tú» del que pudiera avergonzarse, pero Oblonsky comprendía que su amigo pensaba que él tendría tal vez recelos en demostrarle su intimidad en presencia de sus subalternos y por eso le arrastró a su despacho.	The Secretary went out, abashed.	quando usciranno i membri, allora...	um zwei Uhr kam dann eine Frühstückspause.
-- Ну, пойдем в кабинет, -- сказал Степан Аркадьич, знавший самолюбивую и озлобленную застенчивость своего приятеля; и, схватив его за руку, он повлек его за собой, как будто проводя между опасностями.	Levin era de la misma edad que Oblonsky.	Levin, who during Oblonsky's talk with the Secretary had quite overcome his shyness, stood leaning both arms on the back of a chair and listening with ironical attention.	— Dov’è?	Es war noch nicht zwei Uhr, als die große Glastür des Sitzungssaales plötzlich geöffnet wurde und jemand hereinkam.
"Степан Аркадьич был на ""ты"" почти со всеми своими знакомыми: со стариками шестидесяти лет, с мальчиками двадцати лет, с актерами, с министрами, с купцами и с генерал-адъютантами, так что очень многие из бывших с ним на ""ты"" находились на двух крайних пунктах общественной лестницы и очень бы удивились, узнав, что имеют через Облонского что-нибудь общее."	Su tuteo no se debía sólo a haber bebido champaña juntos, sino a haber sido amigos y compañeros en su primera juventud.	'I don't understand it at all!' he remarked.	— È forse uscito nell’ingresso, non faceva che camminare.	Alle Beamten blickten, erfreut über eine kleine Ablenkung, zur Tür hin;
"Он был на ""ты"" со всеми, с кем пил шампанское, а пил он шампанское со всеми, и поэтому, в присутствии своих подчиненных встречаясь с своими постыдными ""ты"", как он называл шутя многих из своих приятелей, он, со свойственным ему тактом, умел уменьшать неприятность этого впечатления для подчиненных."	No obstante la diferencia de sus inclinaciones y caracteres, se querían como suelen quererse dos amigos de la adolescencia.	'What don't you understand?' asked Oblonsky with his usual merry smile, as he took out a cigarette.	Eccolo — disse l’usciere, indicando un uomo di costituzione forte, largo di spalle, con la barba ricciuta, il quale, senza togliersi il berretto di montone, saliva lesto e leggero i gradini consumati della scala di pietra.	aber der Türhüter, der dort seinen Posten hatte, wies den Eindringling sofort wieder hinaus und machte die Glastür hinter ihm wieder zu.
Левин не	Pero, como pasa a menudo entre personas que eligen diversas profesiones, cada uno, aprobando y comprendiendo la elección del otro, la despreciaba en el fondo de su alma.	He expected Levin to say something eccentric.	Uno di quelli che scendevano, un impiegato magrolino con una cartella sotto il braccio, fermatosi, guardò con riprovazione le gambe di colui che correva e fissò interrogativamente Oblonskij.	Als die Verlesung des gerade vorliegenden Schriftstückes beendet war, erhob sich Stepan Arkadjewitsch, reckte sich ein wenig, holte noch im Sitzungssaale, den fortschrittlichen Anschauungen der modernen Zeit Rechnung tragend, eine Zigarette hervor und machte sich auf nach seinem Arbeitszimmer.
"был постыдный ""ты"", но Облонский с своим тактом почувствовал, что Левин думает, что он пред подчиненными может не желать выказать свою близость с ним, и потому поторопился увести его в кабинет."	Le parecía a cada uno de los dos que la vida que él llevaba era la única real y la del amigo una ficción.	'I don't understand what you're doing,' said Levin shrugging his shoulders.	Stepan Arkad’ic era dritto in cima alla scala.	Zwei seiner Kollegen, der bejahrte, bereits in hohem Dienstalter stehende Nikitin und der Kammerjunker Grinjewitsch, gingen mit ihm zusammen hinaus.
"Левин был почти одних лет с Облонским и с ним на ""ты"" не по одному шампанскому."	Por eso Oblonsky no había podido reprimir una sonrisa burlona al ver a Levin.	'How can you do it seriously?'	Il suo viso bonario, che splendeva emergendo dal bavero ricamato dell’uniforme, s’illuminò ancor più quando riconobbe chi correva.	»Nach dem Frühstück werden wir schon mit der Sache zu Ende kommen«, bemerkte Stepan Arkadjewitsch.
Левин был его товарищем и другом первой молодости.	Varias veces le había visto en Moscú, llegado del pueblo, donde se ocupaba en cosas que Esteban Arkadievich no alcanzaba nunca a comprender bien, y que, por otra parte, no le interesaban.	'Why not?'	— Ma è proprio lui!	»Mit Leichtigkeit!« versetzte Nikitin.
Они любили друг друга, несмотря на различие характеров и вкусов, как любят друг друга приятели, сошедшиеся в первой молодости.	Levin llegaba siempre a Moscú precipitadamente, agitado, cohibido a irritado contra sí mismo por su torpeza y expresando generalmente puntos de vista desconcertantes a inesperados respecto a todo.	'Because there's nothing to do!'	Levin, finalmente!	»Aber ein gehöriger Gauner muß doch dieser Fomin sein«, meinte Grinjewitsch mit Bezug auf eine der Personen, die an der zur Untersuchung stehenden Sache beteiligt waren.
Но, несмотря на это, как часто бывает между людьми, избравшими различные роды деятельности, каждый из них, хотя, рассуждая, и оправдывал деятельность другого, в душе презирал ее.	Esteban Arkadievich encontraba aquello muy divertido.	'That's how it seems to you, but really we're overwhelmed with work.'	— esclamò con un sorriso cordialmente canzonatorio, guardando Levin che gli si avvicinava.	Stepan Arkadjewitsch runzelte bei Grinjewitschs Worten die Stirn, womit er zu verstehen gab, daß es unpassend sei, vorzeitig ein Urteil auszusprechen, und gab ihm keine Antwort.
Каждому казалось, что та жизнь, которую он сам ведет, есть одна настоящая жизнь, а которую ведет приятель -- есть только призрак.	Levin, en el fondo, despreciaba también la vida ciudadana de Oblonsky y su trabajo, que le parecían sin valor.	'- On paper! Ah well! you've a gift for that sort of thing,' added Levin.	— Com’è che non hai disdegnato di venirmi a pescare in quest’antro?	»Wer kam denn da vorhin herein?« fragte er den Türhüter.
Облонский не мог удержать легкой насмешливой улыбки при виде Левина.	La diferencia estribaba en que Oblonsky, haciendo lo que todos los demás, al reírse de su amigo, lo hacía seguro de sí y con buen humor, mientras que Levin carecía de serenidad y a veces se irritaba.	'You mean I'm deficient in something?'	— disse Stepan Arkad’ic baciando l’amico, non contento di una stretta di mano.	»Ich kenne ihn nicht, Euer Exzellenz.
Уж который раз он видел его приезжавшим в Москву из деревни, где он что-то делал, но что именно, того Степан Аркадьич никогда не мог понять хорошенько, да и не интересовался.	–	'Perhaps!' said Levin.	— Sei qui da un pezzo?	Er drang, ohne zu fragen, ein, als ich gerade einmal einen Augenblick den Rücken kehrte.
Левин приезжал в Москву всегда взволнованный, торопливый, немножко стесненный и раздраженный этою стесненностью и большею частью с совершенно новым, неожиданным взглядом на вещи.	Hace mucho que te esperaba ––dijo Oblonsky, entrando en el despacho y soltando el brazo de su amigo, como para indicar que habían concluido los riesgos–.	'But all the same I admire your dignity and am proud that my friend is such a great man!	— Sono arrivato or ora, e avevo una gran voglia di vederti — rispose Levin, guardandosi attorno timido e, nello stesso tempo, inquieto e contrariato.	Er fragte dann nach Ihnen.
Степан Аркадьич смеялся над этим и любил это.	Estoy muy contento de verte –––continuó–––.	But all the same you've not answered my question,' he added, making a desperate effort to look Oblonsky straight in the face.	— Su, andiamo nel mio gabinetto — disse Stepan Arkad’ic, conoscendo la timidezza ombrosa e scontrosa dell’amico;	Ich habe ihm gesagt: wenn die Herren herauskommen, dann ...«
Точно так же и Левин в душе презирал и городской образ жизни своего приятеля и его службу, которую считал пустяками, и смеялся над этим.	¿Cuándo has llegado?	'All right!	e, presolo per un braccio, lo trascinò dietro di sé come per guidarlo in mezzo ai pericoli.	»Wo ist er denn?«
Но разница была в том, что Облонский, делая, что все делают, смеялся самоуверенно и добродушно, а Левин не самоуверенно и иногда сердито.	Levin callaba, mirando a los dos desconocidos amigos de Esteban Arkadievich y fijándose, sobre todo, en la blanca mano del elegante Grinevich, una mano de afilados y blancos dedos y de largas uñas curvadas en su extremidad.	All right!	Stepan Arkad’ic si dava del «tu» con quasi tutti i suoi conoscenti:	»Er muß wohl eben auf den Flur hinuntergegangen sein;
-- Мы тебя давно ждали, -- сказал Степан Аркадьич, войдя в кабинет и выпустив руку Левина, как бы этим показывая, что тут опасности кончились.	Aquellas manos surgiendo de los puños de una camisa adornados de brillantes y enormes gemelos, atraían toda la atención de Levin, coartaban la libertad de sus pensamientos.	Wait a bit, and you'd be in the same position yourself.	coi vecchi di sessant’anni, coi ragazzi di venti;	bis vor kurzem ist er immer hier auf und ab gewandert.
-- Очень, очень рад тебя видеть, -- продолжал он.	Oblonsky se dio cuenta y sonrió.	It's all very well for you, who have three thousand desyatins in the Karazin District, and such muscles, and are as fresh as a twelve-year-old girl!	con gli attori, coi ministri, coi negozianti e con gli aiutanti generali;	Da ist er«, sagte der Türhüter und wies auf einen kräftig gebauten, breitschulterigen, krausbärtigen Mann, der, ohne seine Schaffellmütze abzunehmen, schnell und behend die abgetretenen Stufen der Steintreppe heraufgelaufen kam.
-- Ну, что ты?	–Permitidme presentaros –	But still, you'll be joining us yourself some day!...	così che molti di quelli che gli davano del «tu» si trovavano ai due punti estremi della scala sociale, e molti si sarebbero stupiti nel constatare di avere qualcosa di comune per mezzo di Oblonskij.	Ein hagerer Beamter, der mit den übrigen, seine Aktenmappe unter dem Arm, die Treppe hinunterstieg, blieb stehen, warf einen mißbilligenden Blick auf die Beine des Laufenden und blickte dann fragend Oblonski an.
Как?	–	Now, about what you were asking: nothing has changed, but it's a pity you've stopped away so long.'	Egli dava del «tu» a tutti quelli con i quali beveva lo champagne, e di champagne ne beveva con tutti;	Stepan Arkadjewitsch stand oben an der Treppe.
Когда приехал?	dijo–.	'Why?' asked Levin in alarm.	perciò, incontrandosi in presenza dei suoi dipendenti con i suoi «tu» vergognosi, come chiamava scherzando molti amici, sapeva diminuire, con quel tatto che gli era proprio, la spiacevolezza dell’impressione che potevano riportarne i dipendenti.	Sein gutmütig glänzendes Gesicht über dem gestickten Uniformkragen strahlte plötzlich noch heller auf, als er den Heraufkommenden erkannte.
Левин молчал, поглядывая на незнакомые ему лица двух товарищей Облонского и в особенности на руку элегантного Гриневича, с такими белыми длинными пальцами, с такими длинными желтыми, загибавшимися в конце ногтями и такими огромными блестящими запонками на рубашке, что эти руки, видимо, поглощали все его внимание и не давали ему свободы мысли.	Aquí, mis amigos Felipe Ivanovich Nikitin y Mijail Stanislavovich Grinevich.	'Oh, nothing –' answered Oblonsky.	Levin non era un «tu» vergognoso, ma Oblonskij intuì che Levin pensava ch’egli potesse non desiderare di mostrare la propria intimità con lui dinanzi ai propri dipendenti, e perciò si affrettò a condurlo nel proprio gabinetto.	»Wahrhaftig!
Облонский тотчас заметил это и улыбнулся.	Y aquí –añadió volviéndose a Levin–: una personalidad de los estados provinciales, un miembro de los zemstvos5, un gran deportista, que levanta con una sola mano cinco puds6; el rico ganadero, formidable cazador y amigo mío Constantino Dmitrievich Levin, hermano de Sergio Ivanovich Kosnichev.	'We'll talk it over later on.	Levin era quasi della stessa età di Oblonskij e si davano del «tu» non solo per lo champagne.	Ljewin! Endlich einmal!« rief er mit einem freundschaftlichen, ein wenig spöttischen Lächeln, während er den zu ihm tretenden Ljewin musterte.
--	–Mucho gusto en conocerle –dijo el anciano.	But what has brought you here specially?'	Levin gli era compagno e amico di prima giovinezza.	»Wie hast du es nur über dich gewinnen können, mich in dieser Räuberhöhle aufzusuchen?«
Ах да, позвольте вас познакомить, -- сказал он.	–	'We'll talk about that too later on,' said Levin and again blushed to his very ears.	Si volevano bene, malgrado la diversità dei caratteri e dei gusti, così come si vogliono bene gli amici incontratisi nella prima giovinezza.	fuhr Stepan Arkadjewitsch fort und begnügte sich nicht mit einem Händedruck, sondern küßte seinen Freund herzlich. »Bist du schon lange in Moskau?«
--	Tengo el honor de conocer a su hermano Sergio Ivanovich –aseguró Grinevich, tendiéndole su fina mano de largas uñas.	'All right, that's natural enough!' said Oblonsky.	Malgrado ciò, come capita spesso fra persone che hanno scelto generi diversi di attività, ciascuno di loro, pur giustificando col ragionamento l’attività dell’altro, finiva col disprezzarla dentro di sé.	»Ich bin eben erst angekommen und wollte dich gern sprechen«, antwortete Ljewin und blickte dabei schüchtern und zugleich ärgerlich und unruhig um sich.
Мои товарищи: Филипп Иваныч Никитин, Михаил Станиславич Гриневич, -- и обратившись к Левину: -- земский деятель, новый земский человек, гимнаст, поднимающий одною рукой пять пудов, скотовод и охотник и мой друг, Константин Дмитрич Левин, брат Сергея Иваныча Кознышева.	Levin arrugó el entrecejo, le estrechó la mano con frialdad y se volvió hacia Oblonsky.	'Well, you know, I'd ask you to come to us, but my wife is not very well.	A ciascuno sembrava che la vita che egli stesso conduceva fosse la vera vita, mentre l’altra, quella che conduceva l’amico, non ne fosse che la parvenza.	»Na, komm mit in mein Arbeitszimmer!« sagte Stepan Arkadjewitsch, der die empfindliche, leicht reizbare Schüchternheit seines Freundes kannte;
-- Очень приятно, -- сказал старичок.	Aunque apreciaba mucho a su hermano de madre, célebre escritor, le resultaba intolerable que no le consideraran a él como Constantino Levin, sino como hermano del ilustre Koznichev.	Let's see, – if you want to meet them, you'll be sure to find them in the Zoological Gardens from four to five.	Oblonskij non poteva trattenere un lieve riso canzonatorio alla vista di Levin.	er faßte ihn an der Hand und zog ihn mit sich, als ob er ihn durch drohende Gefahren hindurchgeleiten wollte.
-- Имею честь знать вашего брата, Сергея Иваныча, -- сказал Гриневич, подавая свою тонкую руку с длинными ногтями.	–	Kitty skates there.	L’aveva visto già varie volte arrivare a Mosca dalla campagna dove faceva qualcosa;	Stepan Arkadjewitsch stand mit fast allen seinen Bekannten auf du und du: mit alten Männern von sechzig Jahren und mit jungen von zwanzig Jahren, mit Schauspielern, Ministern, Kaufleuten und Generaladjutanten, so daß sehr viele seiner Duzfreunde sich an den beiden entgegengesetzten Enden der gesellschaftlichen Stufenleiter befanden und sehr verwundert gewesen wären, zu erfahren, daß sie in Oblonski einen gemeinsamen Berührungspunkt hatten.
Левин нахмурился, холодно пожал руку и тотчас же обратился к Облонскому.	Ya no pertenezco al zemstvo –dijo, dirigiéndose a Oblonsky–.	Go there, and I'll call for you and we'll dine somewhere together.'	che cosa facesse precisamente, Stepan Arkad’ic non aveva mai potuto capir bene e non se ne curava.	Er duzte sich mit allen, mit denen er Champagner getrunken hatte, und Champagner trank er mit all und jedem.
Хотя он имел большое уважение к своему, известному всей России, одноутробному брату писателю, однако он терпеть не мог, когда к нему обращались не как к Константину Левину, а как к брату знаменитого Кознышева.	Me peleé con todos.	'Splendid! Well then, au revoir!'	Levin veniva a Mosca sempre agitato, frettoloso, un po’ timido e urtato da questa timidezza, e quasi sempre con delle vedute nuove e inaspettate su tutte le cose.	Traf er nun in Anwesenheit von Beamten, die ihm unterstellt waren, mit seinen ›kompromittierenden Duzfreunden‹, wie er im Scherze viele seiner Freunde nannte, zusammen, so verstand er es mit dem ihm eigenen Takte, den unangenehmen Eindruck abzuschwächen, den dies auf seine Untergebenen machen konnte.
-- Нет, я уже не земский деятель.	No asisto ya a sus reuniones.	'Mind you don't forget!	Stepan Arkad’ic ne rideva e se ne compiaceva.	Ljewin gehörte nicht zu diesen kompromittierenden Duzfreunden;
Я со всеми разбранился и не езжу больше на собрания, -- сказал он, обращаясь к Облонскому.	–¡Caramba, qué pronto te has cansado! ¿Como ha sido eso?	I know you – you may rush off back to the country!' shouted Oblonsky after him.	Nello stesso preciso modo Levin disprezzava dentro di sé il modo di vivere cittadino dell’amico e quel suo impiego che considerava sciocco e vuoto, e ci rideva su.	aber Oblonski merkte mit dem feinen Gefühl, das er für solche Dinge besaß, daß Ljewin glaubte, er, Oblonski, möge vor seinen Untergebenen nicht gern sein engeres Verhältnis zu ihm, Ljewin, bekunden;
-- Скоро же! -- с улыбкой сказал Облонский. --	–preguntó su amigo, sonriendo.	'That'll be all right!' said Levin and left the room, only recollecting when already at the door that he had not taken leave of Oblonsky's colleagues.	Ma la differenza consisteva in questo:	darum beeilte sich Oblonski, ihn in sein Arbeitszimmer zu führen.
Но как?	–	'He seems a very energetic man,' said Grinevich when Levin was gone.	Oblonskij, facendo quello che fanno tutti, rideva con sicurezza e bonarietà, Levin, invece, senza sicurezza e, a volte, con dispetto.	Ljewin war beinah gleichen Alters mit Oblonski, und seine Duzfreundschaft mit ihm stammte nicht etwa nur vom Champagner her.
отчего?	Es una historia larga.	'Yes, my dear fellow,' said Oblonsky, shaking his head, 'and he's a lucky man!	— Ti aspettavamo da tempo — disse Stepan Arkad’ic entrando nello studio e lasciando il braccio di Levin come a dire che là non c’erano più pericoli.	Ljewin war schon in früher Jugend sein Kamerad und Freund gewesen.
--	Otro día te la contaré –replicó Levin.	Three thousand desyatins in the Karazin District, his life before him, and such freshness!	— Sono molto contento di rivederti.	Sie mochten einander gern trotz der Verschiedenheit der Charaktere und Neigungen, wie eben Freunde einander gern haben, die sich in früher Jugend zusammengefunden haben.
Длинная история.	Pero a continuación comenzó a relatarla: –En una palabra: tengo la certeza de que no se hace ni se podrá hacer nada de provecho con los zemstvos –profirió como si contestase a una injuria–.	Not like some of us!'	Ebbene, come va?	Aber trotzdem ging es auch bei ihnen, wie so oft bei Leuten, die sich für stark verschiedene Arten von Tätigkeit entschieden haben:
Я расскажу когда-нибудь, -- сказал Левин, но сейчас же стал рассказывать.	Por un lado, se juega al parlamento, y yo no soy ni bastante viejo ni bastante joven para divertirme jugando.	'What have you to complain of, Stephen Arkadyevich?'	Quando sei arrivato?	obgleich ein jeder von ihnen der Tätigkeit des anderen bei genauerer Überlegung Gerechtigkeit widerfahren ließ, schätzte er sie doch im Grunde seiner Seele gering.
-- Ну, коротко сказать, я убедился, что никакой земской деятельности нет и быть не может, -- заговорил он, как будто кто-то сейчас обидел его, -- с одной стороны, игрушка, играют в парламент, а я ни достаточно молод, ни достаточно стар, чтобы забавляться игрушками; а с другой (он заикнулся) стороны, это -- средство для уездной coterie наживать деньжонки...	Por otra parte –Levin hizo una pausa– ... es una manera que ha hallado la coterie7 rural de sacar el jugo a las provincias.	'Oh, things are wretched, miserable!' said Oblonsky, and sighed heavily.	Levin taceva, sbirciando le due facce dei colleghi di Oblonskij che non conosceva, e in particolar modo dell’elegante Grinevic dalle dita affilate e bianche, e dalle unghie così lunghe, gialle e ricurve in punta, e dai gemelli della camicia così grossi e luccicanti che queste mani, evidentemente, avevano assorbito tutta la sua attenzione e non gli davano libertà di pensiero.	Jedem schien das Leben, das er selbst führte, das einzig wahre Leben zu sein und das des Freundes nur eine Karikatur des Daseins.
Прежде были опеки, суды, а теперь земство, не в виде взяток, а в виде незаслуженного жалованья, -- говорил он так горячо, как будто кто-нибудь из присутствовавших оспаривал его мнение.	Antes había juicios y tutelas, y ahora zemstvos, no en forma de gratificaciones, sino de sueldos inmerecidos –concluyó con mucho calor, como si alguno de los presentes le hubiese rebatido las opiniones.	CHAPTER VI	Oblonskij lo notò subito, e sorrise.	Oblonski konnte, sobald er Ljewin zu sehen bekam, ein leises, spöttisches Lächeln nicht unterdrücken.
-- Эге!	–Por lo que veo, atraviesas una fase nueva, y esta vez conservadora –dijo Oblonsky–.	WHEN OBLONSKY ASKED LEVIN HIS REASON for coming to town, Levin had blushed and been angry with himself for blushing, because he could not answer: 'I have come to propose to your sister-in-law,' although he really had come solely for that purpose.	— Ah, già, permettete che vi presenti — disse.	Wer weiß wie oft hatte er ihn nun schon von seinem Gute, wo er sich irgendwelcher Tätigkeit hingab, nach Moskau kommen sehen;
